{
  "name": "Pivotal Mining",
  "slug": "pivotal-mining",
  "website": "https://pivotalmining.com",
  "region": "North America",
  "country": "USA",
  "logo": "pivotal-mining.png",
  "description": "Official Bitaxe reseller serving the US market. Ships within 2 business days.",
  "active": true,
  "social": {
    "x": "https://x.com/pivotalmining",
    "instagram": "",
    "youtube": ""
  }
}
