{
  "name": "Bitcraft Europe",
  "slug": "bitcraft-europe",
  "website": "https://bitcraft.eu",
  "region": "Europe",
  "country": "Germany",
  "logo": "bitcraft-europe.png",
  "description": "Bitaxe hardware and accessories shipped across the EU with same-week dispatch.",
  "active": true,
  "social": {
    "x": "https://x.com/bitcrafteu",
    "instagram": "https://instagram.com/bitcrafteu",
    "youtube": ""
  }
}
