{
  "name": "Bharat Hash",
  "slug": "bharat-hash",
  "website": "https://bharathash.in",
  "region": "India",
  "country": "India",
  "logo": "bharat-hash.png",
  "description": "Bitaxe hardware shipped across India. Mumbai-based, pan-India delivery.",
  "active": true,
  "social": {
    "x": "https://x.com/bharathash",
    "instagram": "https://instagram.com/bharathash",
    "youtube": ""
  }
}
